{
  "schema_version": "0.2",
  "comparisonAsOfDate": "2026-09-01",
  "organisations": [
    {
      "organisation": {
        "orgId": "org-demo",
        "country": "GB",
        "sizeBand": "small",
        "sizeBandReferenceDate": "2026-09-01"
      },
      "units": [
        {
          "unitId": "unit-demo",
          "orgId": "org-demo",
          "headcountBand": "10-19",
          "headcountReferenceDate": "2026-09-01"
        }
      ],
      "workers": [
        {
          "pseudonymId": "owhs:pseudo:0123456789abcdef0123456789abcdef",
          "orgId": "org-demo",
          "unitId": "unit-demo",
          "ageBand": "35-49"
        }
      ],
      "absences": [
        {
          "episodeId": "abs-2026-000123",
          "pseudonymId": "owhs:pseudo:0123456789abcdef0123456789abcdef",
          "reasonCode": "musculoskeletal",
          "startDate": "2026-03-02",
          "endDate": "2026-03-16",
          "workingDaysLost": 10,
          "workingHoursLost": 75,
          "fitNoteFlag": true,
          "workRelatedFlag": false,
          "sourceProvenance": {
            "sourceType": "manual",
            "sourceProvider": "Synthetic example"
          }
        }
      ],
      "rtwOutcomes": [
        {
          "outcomeId": "rtw-2026-000123",
          "absenceEpisodeId": "abs-2026-000123",
          "pseudonymId": "owhs:pseudo:0123456789abcdef0123456789abcdef",
          "outcomeType": "phased",
          "adjustmentTypes": [
            "phased-return",
            "altered-hours"
          ],
          "rtwDate": "2026-03-17",
          "sustainedAt": [
            {
              "checkpointWeeks": 4,
              "status": "sustained"
            },
            {
              "checkpointWeeks": 13,
              "status": "sustained"
            }
          ]
        }
      ],
      "ohEpisodes": [
        {
          "ohEpisodeId": "oh-2026-000045",
          "pseudonymId": "owhs:pseudo:0123456789abcdef0123456789abcdef",
          "referralReason": "return-to-work",
          "referralDate": "2026-03-05",
          "assessmentType": "management-referral",
          "assessmentDate": "2026-03-11",
          "fitnessOpinion": "fit-with-adjustments",
          "recommendationTypes": [
            "phased-return",
            "amended-duties"
          ],
          "opinionReleasedToEmployer": true,
          "linkedAbsenceEpisodeId": "abs-2026-000123"
        }
      ],
      "adjustments": [
        {
          "adjustmentId": "adjustment-demo",
          "orgId": "org-demo",
          "pseudonymId": "owhs:pseudo:0123456789abcdef0123456789abcdef",
          "adjustmentCategory": "altered-hours",
          "status": "in-place",
          "startDate": "2026-09-01",
          "sourceOhEpisodeId": "oh-2026-000045"
        }
      ],
      "entitlements": [
        {
          "entitlementId": "entitlement-demo",
          "orgId": "org-demo",
          "layer": "commercial",
          "productCategory": "EAP"
        }
      ],
      "utilisations": [
        {
          "utilisationId": "utilisation-demo",
          "orgId": "org-demo",
          "entitlementId": "entitlement-demo",
          "periodStart": "2026-08-01",
          "periodEnd": "2026-08-31",
          "usageCount": 30,
          "claimCount": 2,
          "n": 20
        }
      ],
      "disabilityParticipations": [
        {
          "reportId": "disability-demo",
          "orgId": "org-demo",
          "period": "August 2026",
          "periodStart": "2026-08-01",
          "periodEnd": "2026-08-31"
        }
      ],
      "contexts": [
        {
          "contextId": "ctx-2026q3",
          "orgId": "org-demo",
          "producingSystem": "demo-scoring 2.1",
          "knownLimitations": "Synthetic example. Not assessed.",
          "scoringDescriptor": {
            "descriptorId": "desc-mean",
            "descriptorVersion": "1",
            "method": "period mean of native responses",
            "estimand": "mean response over the observation window",
            "observationWindow": {
              "start": "2026-07-01T00:00:00Z",
              "end": "2026-09-30T23:59:59Z"
            },
            "sourceRef": "https://example.org/methods/desc-mean-1",
            "higherScoreMeaning": "higher-construct",
            "nativeScale": {
              "min": 1,
              "max": 5
            },
            "normalisation": {
              "id": "norm-linear",
              "version": "1",
              "sourceRef": "https://example.org/methods/norm-linear-1"
            },
            "banding": {
              "id": "band-3",
              "version": "1",
              "sourceRef": "https://example.org/methods/band-3-1"
            },
            "threshold": {
              "id": "thr-1",
              "version": "1",
              "sourceRef": "https://example.org/methods/thr-1"
            },
            "missingResponseRule": {
              "id": "mrr-prorate",
              "version": "1",
              "sourceRef": "https://example.org/methods/mrr-prorate-1"
            }
          }
        }
      ],
      "observations": [
        {
          "observationId": "obs-1",
          "orgId": "org-demo",
          "pseudonymId": "owhs:pseudo:0123456789abcdef0123456789abcdef",
          "contextId": "ctx-2026q3",
          "itemId": "item-energy",
          "itemVersion": "2",
          "constructCode": "mental-health",
          "nativeValue": 4,
          "normalisedValue": 75,
          "occasionTs": "2026-08-12T09:15:00Z",
          "safeguardingCategory": false,
          "collectionChannel": "app",
          "samplingDesign": {
            "design": "rotating-subset",
            "scheduleRef": "sched-a"
          }
        }
      ],
      "administrations": [
        {
          "administrationId": "adm-1",
          "orgId": "org-demo",
          "pseudonymId": "owhs:pseudo:0123456789abcdef0123456789abcdef",
          "contextId": "ctx-2026q3",
          "instrumentId": "who-5",
          "instrumentCitation": "Topp CW et al. The WHO-5 Well-Being Index: a systematic review of the literature. Psychother Psychosom 2015;84:167-176.",
          "instrumentVersion": "1998",
          "occasionTs": "2026-08-12T09:20:00+01:00",
          "constructCodes": [
            "mental-health"
          ],
          "completionStatus": "complete",
          "totalScore": 68,
          "band": "moderate",
          "aboveThresholdFlag": false
        }
      ],
      "reports": [
        {
          "reportId": "rep-1",
          "orgId": "org-demo",
          "level": "unit",
          "unitId": "unit-demo",
          "periodStart": "2026-07-01",
          "periodEnd": "2026-09-30",
          "n": 12,
          "observationCount": 30,
          "headcount": 40,
          "eligibleN": 20,
          "completionRate": 0.6,
          "metricCode": "another-metric",
          "measureKind": "observation",
          "releaseCategory": "ordinary",
          "value": 71.5,
          "interval": {
            "low": 65.0,
            "high": 78.0,
            "level": 0.95,
            "method": "bootstrap percentile"
          },
          "suppressed": false,
          "contextId": "ctx-2026q3",
          "benchmarkRef": {
            "benchmarkId": "benchmark-demo",
            "releaseVersion": "1",
            "sourceRef": "https://example.org/benchmark/demo"
          }
        }
      ]
    }
  ],
  "benchmarks": [
    {
      "benchmarkId": "benchmark-demo",
      "releaseVersion": "1",
      "composition": {
        "orgCount": 3,
        "sectors": [],
        "sicVersion": "2007",
        "sizeBands": [
          "small"
        ],
        "sampleSizes": {
          "people": 30,
          "observations": 90
        }
      },
      "percentiles": {
        "method": "Synthetic nearest-rank illustration; equal person weights, no missing values.",
        "values": [
          {
            "probability": 0.25,
            "value": 2
          },
          {
            "probability": 0.5,
            "value": 3
          },
          {
            "probability": 0.75,
            "value": 4
          }
        ]
      },
      "leaveOneOut": false,
      "validFrom": "2026-09-01",
      "validTo": "2026-12-31",
      "source": "Synthetic example; no observed workforce data.",
      "dataPeriodStart": "2026-08-01",
      "dataPeriodEnd": "2026-08-31",
      "measure": {
        "metricCode": "synthetic-score",
        "scoreUnit": "synthetic points",
        "scoringDescriptorRef": "synthetic-method-v1"
      },
      "population": "Synthetic contributing organisations and workers.",
      "samplingMethod": "Constructed example, not a sample survey.",
      "knownLimitations": "Illustration only. Sector composition was not specified. No empirical percentile or population inference.",
      "releaseCategory": "ordinary"
    }
  ],
  "crosswalks": [
    {
      "constructCode": "demands",
      "hseDomain": "demands",
      "crosswalkVersion": "1",
      "sourceRef": "https://www.hse.gov.uk/stress/standards/demands.htm"
    }
  ]
}
